{
  "$schema": "https://json-schema.org/draft/2020-12/schema",
  "title": "Findings manifest — machine-readable mirror of the report's findings",
  "description": "Emitted by the threat-model run alongside the markdown report. The eval validates structure, internal consistency (severity == band(L x I)), grounding (refs resolve to recon), and coverage — none of which need a per-target answer key.",
  "type": "object",
  "additionalProperties": false,
  "required": ["findings", "summary_counts", "no_issue_surface"],
  "properties": {
    "findings": {
      "type": "array",
      "items": {
        "type": "object",
        "additionalProperties": false,
        "required": ["id", "title", "stride_lm", "likelihood", "impact", "severity", "asset_refs", "surface_refs", "attack_path", "remediation"],
        "properties": {
          "id":         { "type": "string", "pattern": "^TM-[0-9]{3}$" },
          "title":      { "type": "string" },
          "stride_lm":  { "type": "array", "minItems": 1, "items": { "enum": ["S", "T", "R", "I", "D", "E", "LM"] },
                          "description": "STRIDE-LM categories; a finding may legitimately span several" },
          "likelihood": { "type": "integer", "minimum": 1, "maximum": 5 },
          "cvss_vector": { "type": ["string", "null"], "pattern": "^AV:[NALP]/AC:[LH]/PR:[NLH]/UI:[NR]$",
                          "description": "optional CVSS v3.1 exploitability vector (AV/AC/PR/UI) decomposing this Likelihood; null or omitted when the Likelihood was not decomposed. The eval recomputes 8.22*AV*AC*PR*UI over this vector and asserts it bands to the stated likelihood (see frameworks.md)." },
          "impact":     { "type": "integer", "minimum": 1, "maximum": 5 },
          "severity":   { "enum": ["LOW", "MEDIUM", "HIGH", "CRITICAL"] },
          "cwe":        { "type": ["array", "null"], "items": { "type": "string", "pattern": "^CWE-[0-9]+$" }, "description": "null or omitted when the finding maps to no CWE" },
          "mitre":      { "type": ["array", "null"], "items": { "type": "string", "pattern": "^T[0-9]{4}(\\.[0-9]{3})?$" }, "description": "null or omitted when the finding maps to no ATT&CK technique" },
          "asset_refs":   { "type": "array", "items": { "type": "string" }, "description": "recon component/data_store ids this finding concerns" },
          "surface_refs": { "type": "array", "items": { "type": "string" }, "description": "recon entry_point/trust_boundary/external_dep ids this finding covers" },
          "attack_path":  { "type": "string" },
          "remediation":  { "type": "string" }
        }
      }
    },
    "summary_counts": {
      "type": "object",
      "additionalProperties": false,
      "required": ["LOW", "MEDIUM", "HIGH", "CRITICAL"],
      "properties": {
        "LOW": { "type": "integer", "minimum": 0 }, "MEDIUM": { "type": "integer", "minimum": 0 },
        "HIGH": { "type": "integer", "minimum": 0 }, "CRITICAL": { "type": "integer", "minimum": 0 }
      }
    },
    "no_issue_surface": {
      "type": "array", "items": { "type": "string" },
      "description": "recon surface ids deliberately judged to carry no finding (so coverage can distinguish 'examined, clean' from 'missed')"
    },
    "kill_chains": {
      "type": "array",
      "description": "multi-step attack chains the analysis identified (the LLM's judgment). Verification requires an attack tree and attack-flow per declared chain; the eval never clusters findings itself.",
      "items": {
        "type": "object",
        "additionalProperties": false,
        "required": ["id", "goal", "steps"],
        "properties": {
          "id": { "type": "string", "pattern": "^KC[0-9]+$" },
          "goal": { "type": "string", "description": "the attacker objective at the root of the chain" },
          "steps": { "type": "array", "minItems": 1, "items": { "type": "string", "pattern": "^TM-[0-9]{3}$" }, "description": "member finding ids, in order" }
        }
      }
    }
  }
}
