{
  "findings": [
    {
      "id": "TM-001",
      "title": "No authentication/authorization on any endpoint (incl. network-position trust)",
      "stride_lm": ["S", "E", "LM"],
      "likelihood": 5,
      "impact": 2,
      "severity": "HIGH",
      "cwe": ["CWE-306"],
      "mitre": ["T1190"],
      "asset_refs": ["C2", "C3", "C5", "C7", "C8"],
      "surface_refs": ["E2", "E3", "TB1", "TB2"],
      "attack_path": "Anonymous client issues GET http://<server-alb>/api/getAllProducts (or /api/docs) with no credential and no control to bypass; every route is unauthenticated. Absorbs the zero-trust/network-position gap (former TM-009): tasks authorize inbound purely by ALB source-SG with no per-request identity, but the fronting ALB is itself Internet-facing, so anything it forwards is implicitly trusted. Root access-control gap that also leaves any future privileged route unprotected by construction and removes the natural throttle/attribution for the abuse findings.",
      "remediation": "Introduce request-level authentication (e.g., ALB OIDC/Cognito, an API gateway with keys/JWT, or mTLS) on both ALBs and, at minimum, on the API; enforce per-request authorization rather than trust-by-network-position. Even for a demo, gate the API behind an auth check so the abuse and future-privileged-route risks are contained."
    },
    {
      "id": "TM-002",
      "title": "Cleartext HTTP on both public ALBs (no TLS) — transit interception & response tampering",
      "stride_lm": ["T", "I"],
      "likelihood": 3,
      "impact": 3,
      "severity": "MEDIUM",
      "cwe": ["CWE-311"],
      "mitre": null,
      "asset_refs": ["C4", "C5"],
      "surface_refs": ["E1", "E2", "TB1", "TB2"],
      "attack_path": "On-path attacker (rogue Wi-Fi / ISP / compromised transit) between the browser and the public ALBs reads all request/response traffic and injects a modified HTTP response (replace the SPA bundle or API JSON) served to the victim's browser. Only an http_listener:80 is instantiated; the https_listener resource exists but is gated behind var.enable_https (default false, never set). No HSTS, no redirect. ALB->task hop is also plaintext.",
      "remediation": "Set enable_https=true, attach an ACM certificate, add an HTTP->HTTPS 301 redirect and HSTS; terminate TLS at the ALB and use HTTPS to the task or keep it inside the VPC. The HTTPS listener already exists in the module, so this is a low-effort flip of an existing flag plus a cert."
    },
    {
      "id": "TM-003",
      "title": "Swagger / OpenAPI UI publicly reachable (/api/docs) — attack-surface enumeration",
      "stride_lm": ["I"],
      "likelihood": 4,
      "impact": 2,
      "severity": "MEDIUM",
      "cwe": ["CWE-200"],
      "mitre": ["T1595"],
      "asset_refs": ["C3"],
      "surface_refs": ["E3", "TB1"],
      "attack_path": "GET /api/docs (the URL is published in the Terraform output) returns the anonymous Swagger UI and machine-readable spec, handing an attacker the full API contract for enumeration. Low intrinsic secrecy today (3 trivial routes) but the blast radius grows silently as the API grows.",
      "remediation": "Do not expose Swagger UI/spec on the public API in production: gate it behind auth, bind it to an internal-only path, or disable it in the deployed image. Keep API docs out of the public Terraform output."
    },
    {
      "id": "TM-004",
      "title": "No WAF / rate limiting / bot control in front of public ALBs — L7 DoS & scraping",
      "stride_lm": ["D"],
      "likelihood": 4,
      "impact": 3,
      "severity": "HIGH",
      "cwe": ["CWE-770"],
      "mitre": ["T1498"],
      "asset_refs": ["C4", "C5", "C12"],
      "surface_refs": ["E1", "E2", "TB1"],
      "attack_path": "A single host floods or scrapes either ALB with no upstream throttle; autoscaling is capped (min 1 / max 4 tasks), so saturation is reached quickly and there is no L7 shield to absorb it.",
      "remediation": "Attach AWS WAF (rate-based rules, bot control, IP reputation) to both ALBs; add per-client rate limiting and request quotas; consider a higher autoscaling ceiling or a CDN/edge shield for the static SPA."
    },
    {
      "id": "TM-005",
      "title": "Unauthenticated full-table scan on every request -> cost amplification / economic DoS",
      "stride_lm": ["D"],
      "likelihood": 4,
      "impact": 3,
      "severity": "HIGH",
      "cwe": ["CWE-400"],
      "mitre": ["T1498"],
      "asset_refs": ["C2", "C5", "D1"],
      "surface_refs": ["E2", "TB1"],
      "attack_path": "/api/getAllProducts issues a full-table DynamoDB scan per call on a PAY_PER_REQUEST table. With no auth (TM-001) and no rate limit (TM-004), an attacker loops the endpoint to drive unbounded read-capacity + data-transfer billing and to exhaust the 4-task ceiling — availability and direct financial impact from a trivial script.",
      "remediation": "Replace the unbounded scan with a paginated Query on an indexed access pattern; add caching (e.g., CloudFront/ElastiCache) in front of the read; enforce rate limits and auth (TM-001/TM-004); set DynamoDB/billing alarms and budget guardrails."
    },
    {
      "id": "TM-006",
      "title": "Permissive CORS (cors() reflects any origin)",
      "stride_lm": ["S", "I"],
      "likelihood": 3,
      "impact": 1,
      "severity": "LOW",
      "cwe": ["CWE-200"],
      "mitre": null,
      "asset_refs": ["C2"],
      "surface_refs": ["E2"],
      "attack_path": "app.use(cors()) reflects any Origin, so any website can read API responses from a visitor's browser. Impact bounded today — responses carry no credentials/cookies and the data is already anonymous/public — but becomes serious the moment auth or cookies are introduced.",
      "remediation": "Configure an explicit CORS origin allowlist scoped to the SPA's known origin(s); do not reflect arbitrary origins. Re-tighten immediately if any authenticated/cookie-bearing endpoint is added."
    },
    {
      "id": "TM-007",
      "title": "Error-message information disclosure to client",
      "stride_lm": ["I"],
      "likelihood": 3,
      "impact": 2,
      "severity": "MEDIUM",
      "cwe": ["CWE-209"],
      "mitre": null,
      "asset_refs": ["C2"],
      "surface_refs": ["E2"],
      "attack_path": "Both the inline scan handler and the error middleware return err.message (and err.status) to the caller. Inducing a backend error (throttle/permission/timeout) leaks AWS SDK internal detail — table name, region, ARNs, throttling/permission specifics — that aids reconnaissance.",
      "remediation": "Return generic client-facing error messages with a correlation id; log the detailed error server-side only. Never surface raw SDK error text or status to the client."
    },
    {
      "id": "TM-008",
      "title": "Fragile error handling on the API error path",
      "stride_lm": ["D"],
      "likelihood": 2,
      "impact": 2,
      "severity": "LOW",
      "cwe": ["CWE-755"],
      "mitre": null,
      "asset_refs": ["C2"],
      "surface_refs": ["E2"],
      "attack_path": "The scan-error branch is handled inline (res.send -> HTTP 200 with code: undefined) — malformed but does not throw. The error middleware's res.status(error.code) throws a RangeError only for a status-less error routed through it, and the stray 'status: err.status || 500' is a dead JS label. A real robustness defect (malformed error responses, brittle degradation) but the unhandled-exception path is largely theoretical for the SDK scan flow.",
      "remediation": "Normalize errors through a single handler: coerce to a valid HTTP status (default 500), remove the dead label, declare AB3_TABLE with const, and return a consistent error body. Add a test that drives the SDK error path."
    },
    {
      "id": "TM-010",
      "title": "ECS task role carries iam:PassRole on * — latent privilege escalation",
      "stride_lm": ["E", "LM"],
      "likelihood": 2,
      "impact": 4,
      "severity": "MEDIUM",
      "cwe": ["CWE-269"],
      "mitre": ["T1078", "T1068"],
      "asset_refs": ["C8"],
      "surface_refs": ["TB3"],
      "attack_path": "The application runtime identity (ECS task role R2) holds iam:PassRole on every role in the account (IAM/main.tf:317-323). An attacker who compromises the server container inherits the task role and can pass any role to a reachable service action — the classic PassRole escalation primitive — unnecessary for a read-only catalog API.",
      "remediation": "Remove the iam:PassRole statement from the task role entirely (the runtime app does not need it) — a one-statement deletion. Keep only the scoped DynamoDB-read and S3-GetObject grants."
    },
    {
      "id": "TM-011",
      "title": "Post-exploitation task-credential theft via IMDS -> cloud pivot",
      "stride_lm": ["I", "E", "LM"],
      "likelihood": 2,
      "impact": 4,
      "severity": "MEDIUM",
      "cwe": ["CWE-200"],
      "mitre": ["T1552"],
      "asset_refs": ["C8"],
      "surface_refs": ["TB3", "TB6"],
      "attack_path": "On container compromise (e.g., a vulnerable/EOL dependency, TM-018), the task role's temporary credentials are readable from the instance metadata service and usable off-box. Combined with unrestricted egress (TM-020) and PassRole (TM-010), a single container foothold becomes a cloud-account foothold.",
      "remediation": "Enforce IMDSv2 (hop limit 1, tokens required) on the tasks; minimize the task role to least privilege (see TM-010); restrict egress (TM-020) so stolen credentials cannot be used off-box; add runtime detection."
    },
    {
      "id": "TM-012",
      "title": "GitHub PAT in plaintext local Terraform state & pipeline config, with no rotation/revocation lifecycle",
      "stride_lm": ["S", "I", "E"],
      "likelihood": 3,
      "impact": 4,
      "severity": "HIGH",
      "cwe": ["CWE-798", "CWE-312"],
      "mitre": ["T1552", "T1078"],
      "asset_refs": ["C9", "D6"],
      "surface_refs": ["X1", "TB4", "TB5"],